{
  "version": "1.0",
  "name": "Native Cassini Mission",
  "bodies": [
    {
      "id": "6",
      "name": "Saturn",
      "geometry": {
        "type": "Globe",
        "radii": [60268.0, 60268.0, 54364.0],
        "rings": { "type": "Rings", "innerRadius": 74500.0, "outerRadius": 140220.0 }
      }
    }
  ],
  "spacecraft": [
    {
      "id": "-82",
      "name": "Probe",
      "arcs": [
        {
          "timeRange": { "start": "2004-06-22T00:00:00Z", "stop": "2004-08-22T00:00:00Z" },
          "trajectory": { "type": "Spice", "center": "6", "frame": "J2000" }
        }
      ]
    }
  ]
}
